{
  "metadata": {
    "filename": "UOB_3530_2025-08-13.pdf",
    "filepath": "static/uploads/customers/Be_rich_CJY/credit_cards/UOB/2025-08/UOB_3530_2025-08-13.pdf",
    "bank": "UOB",
    "card_number": "2026",
    "statement_date": "Dec 31",
    "previous_balance": 0.0,
    "current_balance": 0.0,
    "transaction_count": 0,
    "success": true,
    "parsed_at": "2025-11-17T13:02:45.715273"
  },
  "fields": {
    "card_number": "2026",
    "statement_date": "Dec 31",
    "cardholder_name": "JUN YOON",
    "previous_balance": 0.0,
    "total_credit": 0.0,
    "total_debit": 0.0,
    "current_balance": 0.0,
    "minimum_payment": 0.0,
    "payment_due_date": null,
    "transactions": [],
    "bank_name": "UOB"
  },
  "raw_response": {
    "text": "UOB CARD CENTRE\nUOB ***\nSTATEMENT OF ACCOUNT\n9894\nPage No Halaman\n1 of 5\n13 AUG 25\n02 SEP 25\nCHEOK JUN YOON\n124 JLN 4\nTMN DUYUNG\n70200 SEREMBAN\nStatement Date\nTarikh Penyata\nPayment Due Date\nTarikh Akhir Bayaran\nCredit Limit (RM)\nHad Kredit\nOverlimit Amount (RM)\nAmaun Terlebih Had\n22,000.00\n4,016.43\nH\nI\nG\nH\nL\nI\nG\nH\nT S\nIMPORTANT NOTICE / NOTIS PENTING\nEFFECTIVE 1 JULY 2025, E-INVOICE IS AVAILABLE TO UOB CUSTOMERS IN LINE WITH LHDN'S E-INVOICE\nIMPLEMENTATION. SHOULD YOU REQUIRE AN E-INVOICE, PLEASE CONTACT OR VISIT A UOB BRANCH\nNEAR YOU. / BERKUAT KUASA 1 JULAI 2025, E-INVOIS DISEDIAKAN UNTUK PELANGGAN UOB SELARAS\nDENGAN PELAKSANAAN E-INVOIS OLEH LHDN. SEKIRANYA ANDA MEMERLUKAN E-INVOIS, SILA HUBUNGI\nATAU KUNJUNGI CAWANGAN UOB YANG BERDEKATAN.\nYOUR UNIRINGGIT SUMMARY TABLE /\nJADUAL RINGKASAN UNIRINGGIT ANDA\nTHE TOTAL BALANCE SHOWN IN THE STATEMENT DOES NOT REFLECT THE LATEST UNIRINGGIT\nAVAILABLE FOR REDEMPTION. KINDLY REFER TO UOB TMRW OR UOB PERSONAL INTERNET BANKING\nFOR THE LATEST UNIRINGGIT AVAILABLE./ JUMLAH TERKINI DI DALAM PENYATA INI TIDAK MEMAPARKAN\nJUMLAH KESELURUHAN UNIRINGGIT YANG TERSEDIA UNTUK PENEBUSAN. SILA RUJUK UOB TMRW ATAU\nPERBANKAN INTERNET PERIBADI UOB UNTUK MENDAPATKAN JUMLAH UNIRINGGIT YANG TERKINI.\nSUSPENSION NOTICE ON OVERDUE\nACCOUNT / NOTIS PENGGANTUNGAN\nPADA AKAUN TERTUNGGAK\nNotice On Paying Only\nMinimum Monthly\nRepayment\nIF ANY OF YOUR UOB CREDIT CARDS IS OVERDUE BY MORE THAN TWO (2) MONTHS OR THIRTY SEVEN\n(37) DAYS PAST ITS DUE DATE, PLEASE BE INFORMED THAT ALL YOUR OTHER RELATED UOB CREDIT\nCARDS (IF ANY) WILL BE SUSPENDED. / SEKIRANYA MANA-MANA KAD KREDIT UOB ANDA TELAH\nTERTUNGGAK MELEBIHI DUA (2) BULAN ATAU TIGA PULUH TUJUH (37) HARI DARI TEMPOH TARIKH AKHIR\nBAYARAN, SILA AMBIL MAKLUM BAHAWA SEMUA KAD KREDIT UOB BERKAITAN (JIKA ADA) AKAN\nDISEKAT/DIGANTUNG.\nIf you make only the minimum payment each period, you will pay more\nin interest and it will take you longer to pay off your balance. Please\nrefer to the back page for more information. Alternatively, you may also\nrefer to the credit card calculator available on our website or banking\ninfo website.\nUnited Overseas Bank (Malaysia) Bhd (271809K) Menara UOB, Jalan Raja Laut, 50350 Kuala Lumpur\nUOB CARD CENTRE\nUOB ***\n*\nSTATEMENT OF ACCOUNT\nIMPORTANT INFORMATION / MAKLUMAT PENTING\nWhat is Minimum Payment Due? / Apakah Bayaran Minimum?\n5% of the Total Balance Due or a minimum of RM50, whichever higher. / 5% daripada jumlah Bayaran Perlu Dibayar atau minimum RM50, yang mana lebih\ntinggi.\nPayment Methods / Cara Pembayaran\nPayment can be made via: / Bayaran boleh dibuat melalui:\nStanding Instruction to debit your UOB current/savings account; / Arahan Tetap untuk debit akaun semasa/simpanan UOB anda;\nUOB Call Centre Phone Banking; / Perbankan Telefon UOB Call Center;\nUOB Internet Banking; / Perbankan Internet UOB;\nCash/Cheque through the Cash/Cheque Deposit Machine/Over-the-Counter at any United Overseas Bank Branches or at UOB Credit Card Centre; / Wang\nTunai/Cek menerusi Mesin Deposit Tunai/Cek atau melalui kaunter di mana-mana Cawangan United Overseas Bank atau Pusat Kad Kredit UOB;\nFund transfer from your deposit account to your Credit Card account through ATM. / Pindahan Dana daripada akaun deposit anda kepada akaun Kad Kredit\nanda menerusi ATM.\nIf you are mailing in your payment, please:- / Untuk pembayaran melalui pos, sila:-\nMake your cheque payable to \"UOB Card Centre for your name)\"; / Keluarkan cek di atas nama \"UOB Card Centre (diikuti nama anda)\";\nWrite your name and card account number(s) on the back of the cheque; / Tuliskan nama dan nombor (- nombor) akaun kad anda dibelakang cek;\nEnclose the payment advice slip at the bottom portion of your statement together with your cheque and send to \"United Overseas Bank Card Centre, P.O.Box\n10621, 50720 Kuala Lumpur\". / Lampirkan slip maklumat pembayaran yang terdapat pada bahagian bawah penyata anda, bersama-sama cek anda dan\nposkan ke \"United Overseas Bank Card Centre, P.O. Box 10621, 50720 Kuala Lumpur\".\nYour payment will be credited upon clearance of the cheque. / Pembayaran anda akan dikreditkan apabila cek tersebut dijelaskan.\nNote: Please DO NOT send cash through the post. / Nota: JANGAN kirimkan wang tunai melalui pos.\nSCENARIO ON PAYING ONLY MINIMUM MONTHLY REPAYMENT:\nThe following table illustrates the amount of interest incurred and the repayment period, under different Total Balance Due scenarios if you continue to pay only\nthe Minimum Payment Due at the interest rate of 18% p.a. The computations are based on (1) 5% minimum payment monthly or RM50, whichever is higher,\nmade on payment due date, (2) using 30 days as one month, (3) no new retail transactions, (4) the 20 days interest-free period shall not be applicable as you are\nnot making full payment of the Total Balance Due on or before the payment due date, (5) the assumption that the interest rate is the same for the entire tenure of repayment\nof the Total Balance Due.\nNote: For Private Label (PLC) cardmembers full payment of the Total Balance Due has to be made.\nSENARIO SEKIRANYA HANYA MEMBAYAR BAYARAN MINIMUM BULANAN:\nJadual berikut memberi gambaran jumlah faedah yang dikenakan dan tempoh pembayaran balik, bagi senario-senario berbeza Baki Perlu Bayar sekiranya anda hanya\nmembuat bayaran minimum secara berterusan di bawah kadar faedah 18% setahun. Pengiraan adalah berdasarkan (1) 5% bayaran minimum bulanan atau RM50,\nmengikut mana yang lebih tinggi, dibuat pada tarikh cukup tempoh, (2) menggunakan 30 hari sebagai satu bulan, (3) tiada transaksi pembelian baru, (4) Tempoh 20 hari\nbebas-faedah tidak terpakai memandangkan anda tidak membuat bayaran penuh Baki Perlu Bayar pada atau sebelum tarikh tamat tempoh, (5) Anggapan pada kadar\nfaedah adalah sama bagi sepanjang tempoh pembayaran balik Baki Perlu Bayar.\nNota: Untuk Pemegang Kad Label Persendirian (PLC), pembayaran penuh untuk Baki Perlu Bayar harus dibuat.\nStandard illustrative example on how long it would take pay off outstanding balance / Contoh penerangan mengenai tempoh pembayaran baki tertunggak.\nExamples under different outstanding amount scenarios / Contoh bagi senario-senario baki belum jelas yang berbeza\nTotal Balance Due (RM) /\nBaki belurn jelas (RM)\n3,000\n5,000\n10,000\nRepayment/Pembayaran balik Pay only minimum Pay RM250 / Pay only minimum Pay RM 350 / Pay only minimum\nPay RM600/\namount (RM150) /Bayar RM250amount (RM250) / Bayar RM350 amount (RM500) \n/\nBayar RM600\nBayaran hanya\nBayaran hanya\nBayaran hanya\nminimum (RM150)\nminimum (RM250)\nminimum (RM500)\nRepayment Period (months) /\nTempoh pembayaran balik (bulan) 4 years 8 months\n1 year 3 months\n5 years 10 months\n1 year 6 months\n7 years 5 months\n1 year 9 months\nTotal interest incurred /\nJumlah faedah yang dikenakan\nRM1,055\nRM333\nRM1,912\nRM670\nRM4,055\nRM1,594\nIMPORTANT NOTES FOR CARDMEMBERS / MAKLUMAT PENTING BAGI PEMEGANG KAD\nA) Finance Charges / Caj Kewangan\nOver-the-limit charges / Caj Lebih Had\nNo charges/Tiada caj\nFinance\nTier /\nPer Annum / Rate Qualification/\nSales Draft Retrieval Fee / Permintaan Draf Jualan\nCharges:Retail\nPeringkat Setahun (%) Kadar Kelayakan\nTransactions\nRM5.00* per Sales Draft (Photocopy) & RM15.00* per Sales Draft\n(Effective 1 May\nTier 1 / 15%\n(Original) / RM5.00 setiap Draf Jualan (Salinan) & RM15.00* setiap Draf Jualan\nYou promptly pay the Minimum\n2012) / Caj\nPeringkat 1\nPayment Due by the Payment\n(Asli)\nKewangan:\nDue Date for the immediately\nStatement Request Fee / Fi Permintaan Penyata\nRM5.00* for walk in or facsimilie request & RM6.00* via email request /\nTransaksi\npreceding 12 consecutive\nRuncit\nmonths. Anda segera\nRM5.00* untuk permintaan datang sendiri atau faksimili & RM6.00* untuk\n(Berkuatkuasa\nmenjelaskan Bayaran Minimum\npermintaan melalui pos\n1 Mei 2012)\nPerlu Dibayar sebelum Tarikh\nCredit Card Courier / Delivery fees for Gift Redemption & Privileges\nAkhir Pembayaran bagi 12\nShopping Items (per Item) / Kurier Kad Kredit / Fi Penghantaran bagi\nbulan terakhir berturut-turut.\nPenebusan Hadiah & Keistimewaan Item Beli-belah (setiap item)\nRM15.00* within Malaysia & RM50 outside Malaysia RM15.00* di dalam\nTier 2 / 17%\nYou promptly pay the Minimum Malaysia & RM50 ke luar Negara.\nPeringkat 2\nPayment Due by the Payment Refund of Credit Balance / Pemulangan Baki Kredit\nDue Date for at least 10 of the RM2.00* for Commission & RM 0.15 for Stamp Duty. / RM2.00* untuk Komisen\nimmediately preceding 12\n& RM0.15 untuk Duti Setem.\nconsecutive months. Anda\nF) Early Settlement Penalty / Penalti penyelesaian awal\nsegera menjelaskan Bayaran up to 5% of outstanding principal amount for Flexi Credit Plan, Easi-Payment\nMinimum Perlu Dibayar\nPlan and/or Balance Conversion/sehingga 5% daripada jumlah prinsipal\nsebelum Tarikh Akhir\ntertunggak untuk Pelan Flexi Credit / Pelan Easi-Payment dan / atau Penukaran\nPembayaran bagi\nBaki\nsekurang-kurangnya 10\ndaripada 12 bulan terakhir\nConversion for overseas transactions / Penukaran bagi transaksi luar\nberturut-turut.\nnegara\nIf you use the Credit Card for a transaction in a currency other than Ringgit\nTier 3 / 18%\nYou do not fall into Tiers 1 or 2. Malaysia, it will be converted through Visa/MasterCard International at the\nPeringkat 3\n/ Anda tidak tergolong dalam\nconversion rate as determined by Visa/MasterCard International as at the\nPeringkat 1 atau 2.\ntime the transaction is posted. In addition an administration cost of 1% or such\nother rate as determined by us for the conversion of the transactions made in a\ncurrency other than Ringgit Malaysia will be chargeable to you /\nUnited Overseas Bank (Malaysia) Bhd (271809K) Menara UOB, Jalan Raja Laut, 50350 Kuala Lumpur\nUOB CARD CENTRE\nUOB ****\nSTATEMENT OF ACCOUNT\nSTATEMENT / PENYATA CHEOK JUN YOON\nIMPORTANT NOTES FOR CARDMEMBERS / MAKLUMAT PENTING BAGI PEMEGANG KAD\nJika anda menggunakan Kad Kredit untuk transaksi dalam mata wang\nselain daripada Ringgit Malaysia, ia akan ditukar melalui Visa /\nMasterCard International pada kadar pertukaran yang ditentukan oleh Visa/\nMasterCard International pada masa transaksi tersebut dicatatkan. Di\nsamping itu kos pentadbiran sebanyak 1% atau kadar lain yang ditentukan\noleh kami untuk penukaran transaksi yang dibuat dalam mata wang selain\ndaripada Ringgit Malaysia akan dikenakan kepada anda.\nH) Dynamic Currency Conversion (DCC) Service / Perkhidmatan\nDynamic Currency Conversion (DCC)\nAll foreign currency transactions converted into Ringgit Malaysia\nthrough the DCC service will be subject to a fee of 1%* of the\nconverted Ringgit Malaysia transaction amount being the fee/ charge\nimposed by Visa/ MasterCard International on the transaction. / Semua\nperbelanjaan mata wang asing yang ditukar melalui perkhidmatan DCC\nakan dikenakan fi DCC sebanyak 1%* atas jumlah Ringgit\nMalaysia yang diurusniagakan/ ditukar, sebagai fi caj yang dikenakan\noleh Visa/MasterCard International atas perbelanjaan tersebut.\nI) Betting Transactions / Urusniaga Pertaruhan\nAll betting transactions, which include purchase of lottery tickets and\nchips at gaming casinos, off-track betting and wagers at race tracks, will\nbe treated as Cash Advance transactions and the relevant Cash\nAdvance Fee and Finance Charges will apply. / Semua urisniaga\npertaruhan termasuk pembelian tiket loteri dan cip permainan kasino,\npertaruhan di luar dan dalam kawasan padang lumba akan dianggap\nsebagai urusniaga Pendahuluan Tunai dan tertakluk kepada Fi\nPendahuluan Tunai serta Caj Kewangan yang berkaitan.\nInterest-Free 20 days from the Statement Date and applicable if\nPeriod / you make full payment by the Payment Due Date. If you\nTempoh Tanpa make partial payment, finance charges for retail\nFaedah\ntransactions will be calculated from the day the\ntransactions are posted to the Credit Card Account. / 20\nhari dari Tarikh Penyata dan adalah berkenaan\njika pembayaran penuh dibuat sebelum Tarikh Akhir\nPembayaran. Jika pembayaran sebahagian dibuat,\ncaj kewangan bagi transaksi runcit akan dikira dari\ntarikh transaksi dimasukkan dalam Akaun Kad\nKredit.\nThe Total Balance Due on Cash Advance(s) will be subjected to\nFinance Charge of 18% per annum, calculated on a daily rest basis\nfrom the date the cash is disbursed until repayment thereof. / Semua\nBaki Perlu Bayar ke atas Pendahuluan Tunai akan dikenakan Caj Kewangan\nsebanyak 18% setahun, dikira berdasarkan kiraan ke atas\nbaki harian dari tarikh wang tunai itu dikeluarkan sehingga tarikh\nbayaran balik tunai tersebut.\nThe formula used for the computation of Finance Charge is as follows: /\nFormula yang digunakan untuk pengiraan Caj Kewangan adalah\nseperti berikut:\nf = (B) x (P/D) x (R)\nF = Sum(f)/Jumlah(f)\nF\nis the total Finance Charge imposed for the month.\nSum(f) is the sum of all Finance Charges computed on the different\nBalances that may be imposed with Finance Charges over\nthe applicable periods during the month.\nf\nis the Finance Charges for a particular Balance B computed\nover the period of P days.\nB\nis the Balance that is imposed with Finance Charge.\nP\nis the respective period in days on which the Balance \"B\" is\nimposed with Finance Charges.\nD\nis the number of days used as the base for the annual rate.\nR\nis the nominal Finance Charge annual rate stated.\nF\nadalah jumlah Caj Kewangan yang dikenakan untuk\nsesuatu bulan.\nJumlah(f) adalah jumlah semua Caj Kewangan yang dikira ke atas\nBaki berlainan yang mungkin dikenakan dengan Caj\nKewangan ke atas tempoh boleh digunapakai semasa\nsesuatu bulan.\nf\nadalah Caj Kewangan untuk sesuatu baki B yang dikira ke\natas tempoh P hari.\nB\nadalah Baki yang dikenakan dengan Caj Kewangan.\nP\nadalah tempoh tertentu dalam hari, yang mana Baki \"B\"\ndikenakan dengan Caj Kewangan.\nD\nadalah bilangan hari yang digunakan sebagai asas untuk\nkadar tahunan.\nR\nadalah kadar tahunan Caj Kewangan nominal yang\ndinyatakan.\nBalance Transfers / Pemindahan Baki 18% p.a. or 1.5% per month\nof the full outstanding balance calculated on a daily rest basis until\nthe amount is settled in full. / 18% setahun atau 1.5% sebulan daripada\nbaki tertunggak yang\ndikira berdasarkan baki harian\nsehingga jumlah itu diselesaikan sepenuhnya\nB) Payment Allocation Notice / Notis Peruntukan Pembayaran\nPayments made to the Bank in respect of the card account will be applied\nto the outstanding amount of the card transactions, the order of settlement\nstarting from the amounts subject to the highest rate to the amounts\nsubject to the lowest rate./ Bayaran yang dibuat kepada Bank bagi akaun\nkad akan digunapakai untuk jumlah tertunggak bagi transaksi kad, aturan\npenyelesaian bermula dari jumlah-jumlah yang tertakluk kepada kadar\nyang paling tinggi ke jumlah-jumlah yang tertakluk kepada kadar yang\npaling rendah.\nC) Late Payment Charges / Caj Pembayaran Lewat\n1% of the total outstanding balance as at statement date or a\nminimum of RM10, whichever is higher, subject to a maximum of\nRM100.1% daripada jumlah keseluruhan baki tertunggak pada\ntarikh penyata atau minimum RM10, yang\nmana lebih tinggi,\ntertakluk kepada maksimum RM100.\nD) Cash Advance Fees / Fi Wang Pendahuluan\nA one time fee of 5%* on the amount withdrawn or RM20.00* + 18% p.a\ndaily interest, whichever is higher will be charged to your\naccount. / Satu Fi sekali bayar sebanyak 5%* daripada jumlah\nyang dikeluarkan atau RM20.00* + faedah harian 18% setahun,\nyang mana lebih tinggi akan dicajkan kepada akaun anda.\nE) Other Fees/Charges / Lain-lain Fi/Yuran\nReplacement for lost or stolen card / Penggantian kad hilang\natau kecurian\nRM50 per card replacement / RM50 setiap kad penggantian\nJ) Lost Or Stolen Card / Kehilangan Atau Kecurian Kad\nReport your lost or stolen card immediately with UOB Call Centre or if\nyou are traveling abroad, please contact VISA/MASTERCARD Travel\nService Centre or nearest affiliates, followed by a written confirmation\nand a police report. RM50 is charged for the replacement of a lost or\nstolen card. In the event you fail to lodge a report, you will be held liable\nfor all unauthorized charge and transactions incurred even if the\namount incurred exceeds the Credit Limit whether before or after the\nreceipt by the Bank of the written confirmation or police report. /\nLaporkan segera kad anda yang hilang atau dicuri kepada UOB Call\nCentre, atau jika\nanda\nberada di luar\nnegara, hubungi\nVISA/MASTERCARD Travel Service Centre atau anggota\ngabungannya yang berdekatan, diikuti dengan pengesahan bertulis\ndan laporkan polis. Caj sebanyak RM50 akan dikenakan bagi\nmanggantikan kad yang hilang atau dicuri, Jikalau anda gagal\nmelaporkan kad yang hilang atau dicuri, anda akan bertanggunjawab ke\natas sebarang caj-caj dan transaksi yang dibuat tanpa kebenaran\nwalaupun jumlahnya melebihi had kredit sama ada sebelum atau selepas\npihak Bank menerima pengesahan secard bertulis atau salinan\nlaporkan polis.\nK) Right to set-off / Hak untuk tolak-selesai\nWe have the right to set-off any credit balance in your account\nmaintained with us against any outstanding balance in this card\naccount. Kami berhak untuk tolak selesai sebarang baki kredit dalam\nakuan yang disimpan dengan kami terhadap sebarang baki tertunggak\ndalam akaun kad kredit ini.\nUnited Overseas Bank (Malaysia) Bhd (271809K) Menara UOB, Jalan Raja Laut, 50350 Kuala Lumpur\nUOB CARD CENTRE\nUOB ***\nSTATEMENT OF ACCOUNT\nPage No Halaman\n2 of 5\nNOTE: The entries and balances shown above will be considered correct unless you notify UOB Call Centre at 03-26128 121 (Kuala Lumpur),\n04-2401 121 (Penang), 07-2881 121 (Johor Bahru), 082-287 121 (Kuching), 088-477 121 (Kota Kinabalu) or email\nuobcustomerservice@uob.com.my for any discrepancies within 14 days from the statement date. If your complaint is not resolved by the\nindicative timeline given, you may then forward the complaint to Bank Negara Malaysia by calling BNMTELELINK at 1-300-88-5465 (9 a.m. - 5 p.m. ,\nMon - Fri) or e-mail bnmtelelink@bnm.gov.my. You may also visit BNMLINK Customer Service Centre (9 a.m. - 5 p.m., Mon - Fri), Ground Floor,\nBlock D, Jalan Dato' Onn, 50480 Kuala Lumpur\nNOTA: Kemasukan dan baki yang tertera di atas adalah dianggap betul melainkan anda menghubungi kami melalui Perbankan Telefon UOB Call\nCentre di 03-26128 121 (Kuala Lumpur), 04-2401 121 (Penang), 07-2881 121 (Johor Bahru), 082-287 121 (Kuching), 088-477 121 (Kota Kinabalu)\natau e-mel kepada uobcustomerservice@uob.com.my tentang sebarang ketidaks amaan dalam masa 14 hari dari tarikh penyata. Jika aduan\nanda masih belum diselesaikan dalam jangka masa yang dijanjikan, anda boleh mengemukakan aduan tersebut kepada Bank Negara Malaysia\ndengan menghubungi BNMTELELINK di 1-300-88-5465 (9 pagi - 5 petang ) atau e-mel bnmtelelink@bnm.gov.my. Anda juga boleh melawat\nPusat Perkhidmatan Pelanggan BNMLINK (9 pagi- 5 petang, Isnin - Jumaat), Tingkat Bawah, Blok D, Bank Negara Malaysia, Jalan Dato' Onn,\n50480 Kuala Lumpur.\nIMPORTANT NOTICE: By paying only the minimum monthly payment, the interest amount and time taken to settle the full balance will\nincrease (please refer overleaf for full details). Late payment charge of 1% of the total outstanding balance as at statement date or a\nminimum of RM10, whichever is higher, subject to a maximum of RM100, will be imposed if you fail to make the Minimum Payment Due on\nPayment Due Date.\nNOTIS PENTING: Jumlah faedah yang harus dibayar dan tempoh yang diambil untuk menjelaskan keseluruhan baki belum jelas anda\nakan bertambah jika anda hanya membayar bayaran minimum bulanan. (Sila rujuk kepada muka surat belakang untuk maklumat lanjut).\nBayaran untuk caj lewat akan dikenakan pada kadar 1% daripada jumlah keseluruhan baki tertunggak pada tarikh penyata atau minimum\nRM10, yang mana lebih tinggi, tertakluk kepada maksimum RM100, jika anda gagal membuat Bayaran Minimum pada Tarikh Akhir Bayaran.\nSST REGISTRATION NO: W10-1808-32001529\nFor enquiries, please email uobcustomerservice@uob.com.my or call UOB Call Centre at 03-26128 121 (Kuala Lumpur), 04-2401 121 (Penang),\n07-2881 121 (Johor Bahru), 082-287 121 (Kuching), 088-477 121 (Kota Kinabalu), or log on to www.bankinginfo.com.my for any banking information.\nUnited Overseas Bank (Malaysia) Bhd (271809K) Menara UOB, Jalan Raja Laut, 50350 Kuala Lumpur\nUOB CARD CENTRE\n#\nUOB\n*\nSTATEMENT OF ACCOUNT\nSTATEMENT / PENYATA - CHEOK JUN YOON\nPage No Halaman\n3 of 5\n13 AUG 25\n1,476.89\nMinimum Payment Due\nBayaran Minimum\nStatement Date\nTarikh Penyata\nPayment Due Date\nTarikh Akhir Bayaran\n02 SEP 25\nPrevious Balance\nBaki Terdahulu\n(RM)\nCreditPayment\nKredit/Bayaran\n(RM)\nDebit/Fees\nDebit / Yuran\n(RM)\nRetail Purchase\nPembelian Runcit\n(RM)\nCash Advance\nPendahuluan Tunai\n(RM)\nTotal Balance Due\nBaki Perlu Dibayar\n(RM)\n3,443.90\n1,747.41\n169.74\n7,734.59\n1.00\n9,600.82\nTransaction Date\nTarikh Transaksi\nTransaction Description\nHuraian Transaksi\nRM\nTransaction Amount\nAmaun Transaksi\n(RM)\n**4141-7000-0828-3530**\nCHEOK JUN YOON\nONE PLATINUM VISA\nCARD\nCREDIT LIMIT\nRM 22,000.00\nPREVIOUS BAL\nPAYMENT REC'D WITH THANKS-DUITNOW\n190.87\n190.87 CR\n09 AUG\n13 AUG\nCASH REBATE OTHERS\n12.04 CR\n13 AUG\nCASH REBATE PETROL\n15.00 CR\n13 JUL\nPETRON LABU SPUR (FI)\nSEREMBAN\nMY\n60.00\n16 JUL\nPSS-AMPAR TENANG\nDENGKIL\nMY\n30.00\n17 JUL\nAMWAY-SEREMBAN\nPETALING JAYA\nMY\n19.00\n18 JUL\nPETRON MRR2 MELATI\nKUALA LUMPUR\nMY\n60.00\n20 JUL\nPETRON LABU SPUR (FI)\nSEREMBAN\nMY\n60.00\n22 JUL\nPSS-AMPAR TENANG\nDENGKIL\nMY\n75.01\n25 JUL\nPETRON LABU SPUR (FI)\nSEREMBAN\nMY\n60.00\n27 JUL\nPSS S2 CITY PARK (LOT C)\nN SEMBILAN\nMY\n66.80\n30 JUL\nPETRONAS RAWAT & REHAT(S)\nSELANGOR\nMY\n60.40\n30 JUL\nAI SMART TECH\nSHAH ALAM\nMY\n6,001.00\n02 AUG\nPSS-KESAS AWAN BESAR\nSHAH ALAM\nMY\n60.50\n04 AUG\nPSS-KESAS AWAN BESAR\nSHAH ALAM\nMY\n75.99\n06 AUG\nLATE FEE CHARGE\n10.00\n06 AUG\nPSS-AMPAR TENANG\nDENGKIL\nMY\n60.01\n10 AUG\nPETRON LABU SPUR (FI)\nSEREMBAN\nMY\n60.00\n13 AUG\nRETAIL INTEREST\n50.10\nSUB-TOTAL\n6,781.77\nMINIMUM PAYMENT DUE\n339.09\nWORLD MASTERCARD\n**5524-0922-0009-4004** CHEOK JUN YOON\nCREDIT LIMIT\nRM 16,000.00\nPREVIOUS BAL\nPAYMENT REC'D WITH THANKS-DUITNOW\n3,253.03\n370.00 CR\n27 JUL\n02 AUG\nPAYMENT REC'D WITH THANKS-DUITNOW\n1,159.50 CR\nUnited Overseas Bank (Malaysia) Bhd (271809K) Menara UOB, Jalan Raja Laut, 50350 Kuala Lumpur\nUOB CARD CENTRE\nUOB ***\n*\nSTATEMENT OF ACCOUNT\nSTATEMENT / PENYATA CHEOK JUN YOON\nPage No Halaman\n4 of 5\nTransaction Date\nTarikh Transaksi\nTransaction Description\nHuraian Transaksi\nRM\nTransaction Amount\nAmaun Transaksi\n(RM)\n30.58\n31 JUL\nBC INTEREST\n07/123.990%\n31 JUL\nBC INSTALMENT 07/12 - 3.990%\n766.44\n05 AUG\nFCP INTEREST\n06/364.990%\n32.85\n05 AUG\nFCP INSTALLMENT 06/36 - 4.990%\n219.44\n13 AUG\nRETAIL INTEREST\n46.21\nSUB-TOTAL\n2,819.05\nMINIMUM PAYMENT DUE\n1,137.80\n** END OF STATEMENT**\nNote: Credit balance do not automatically offset total balance payable.\nUnited Overseas Bank (Malaysia) Bhd (271809K) Menara UOB, Jalan Raja Laut, 50350 Kuala Lumpur\nUOB CARD CENTRE\nUOB ***\nSTATEMENT OF ACCOUNT\nSTATEMENT / PENYATA - CHEOK JUN YOON\nPage No Halaman\n5 of 5\nUOB Loan Instalment Transaction Summary / Ringkasan Transaksi Pinjaman Ansuran UOB\nLoan Description\nCurrent Tenure Total Principal Amount Interest Rate\nHuraian Pinjaman\nBulan Semasa\nJumlah Amaun Kadar Faedah\nPrinsipal (RM)\n(%)\nMonths Unbilled\nBaki Bulan\nBelum Dibil\nAmount Unbilled\nAmaun Belum Dibil\n(RM)\nBC PLAN 3.99%\n07/12\n9,197.33\n3.99\n05\n3,832.25\nFCP 4.99%\n06/36\n7,900.00\n4.99\n30\n6,583.36\nNote: Please refer to the Transaction Description table if you have more than 300 active instalment loans.\nNota: Sila rujuk jadual Huraian Transaksi jika anda mempunyai lebih daripada 300 pinjaman ansuran aktif.\nCard No /\nNo kad\nUNIRinggit\nPrevious Balance /\nUNIRinggit Jumlah\nTerdahulu\nUNIRinggit Earned /\nUNIRinggit Diperolehi\nUNIRinggit\nRedeemed /\nUNIRinggit Dilunasi\nUNIRinggit Expired /\nUNIRinggit Dilupus\nTotal Balance /\nJumlah Terkini\nYour UOB Credit Cards\n9,132.00\n.00\n.00\n.00\n9,132.00\nUNIRinggit Expiring On/\nUNIRinggit Lupus Pada\n2025\n2026\n2027\n2028\nMarch 31\n21\nJune 30\n5441\n2500\nSept 30\nDec 31\n1170\nUnited Overseas Bank (Malaysia) Bhd (271809K) Menara UOB, Jalan Raja Laut, 50350 Kuala Lumpur\nUOB CARD CENTRE\n#UOB\n*\nSTATEMENT OF ACCOUNT\nUnited Overseas Bank (Malaysia) Bhd (271809K) Menara UOB, Jalan Raja Laut, 50350 Kuala Lumpur\n",
    "pages": 8,
    "entities": [
      {
        "type": "client_address",
        "mention_text": "124 JLN 4\nTMN DUYUNG\n70200",
        "confidence": 0.866553783416748,
        "normalized_value": ""
      },
      {
        "type": "client_name",
        "mention_text": "Amaun Terlebih Had",
        "confidence": 0.8638939261436462,
        "normalized_value": ""
      },
      {
        "type": "client_name",
        "mention_text": "CHEOK JUN YOON",
        "confidence": 0.820911705493927,
        "normalized_value": ""
      },
      {
        "type": "account_number",
        "mention_text": "4141-7000-0828-3530",
        "confidence": 0.7096074223518372,
        "normalized_value": ""
      },
      {
        "type": "bank_name",
        "mention_text": "UOB ***",
        "confidence": 0.7020517587661743,
        "normalized_value": ""
      },
      {
        "type": "statement_date",
        "mention_text": "13 AUG 25",
        "confidence": 0.6388227343559265,
        "normalized_value": "2025-08-13"
      },
      {
        "type": "statement_start_date",
        "mention_text": "June 30",
        "confidence": 0.5667053461074829,
        "normalized_value": "--06-30"
      },
      {
        "type": "client_name",
        "mention_text": "TMN DUYUNG",
        "confidence": 0.43632271885871887,
        "normalized_value": ""
      },
      {
        "type": "client_name",
        "mention_text": "JUN YOON",
        "confidence": 0.4352846145629883,
        "normalized_value": ""
      },
      {
        "type": "client_name",
        "mention_text": "JUN YOON",
        "confidence": 0.3954530954360962,
        "normalized_value": ""
      },
      {
        "type": "statement_end_date",
        "mention_text": "Dec 31",
        "confidence": 0.3020974099636078,
        "normalized_value": "--12-31"
      },
      {
        "type": "account_type",
        "mention_text": "UNIRinggit",
        "confidence": 0.14008113741874695,
        "normalized_value": ""
      },
      {
        "type": "account_number",
        "mention_text": "70200",
        "confidence": 0.08546710759401321,
        "normalized_value": ""
      },
      {
        "type": "bank_address",
        "mention_text": "(Malaysia) Bhd (2718",
        "confidence": 0.03952285274863243,
        "normalized_value": ""
      },
      {
        "type": "account_number",
        "mention_text": "2026\n2027",
        "confidence": 0.0310712568461895,
        "normalized_value": ""
      },
      {
        "type": "table_item",
        "mention_text": "que through the Cash/Cheque Deposit Machine/Over-the-Counter at any United Overseas Bank Branches or at UOB Credit Card Centre; / Wang\nTunai/Cek menerusi Mesin Deposit Tunai/Cek atau melalui kaunter di mana-mana Cawangan United Overseas Bank atau Pusat Kad Kredit UOB;",
        "confidence": 1.0,
        "normalized_value": ""
      },
      {
        "type": "table_item",
        "mention_text": "from your deposit account to your Credit Card account through ATM. / Pindahan Dana daripada akaun deposit anda kepada akaun Kad Kredit\nanda menerusi ATM",
        "confidence": 1.0,
        "normalized_value": ""
      },
      {
        "type": "table_item",
        "mention_text": "Pay only minimum Pay RM250 / Pay only minimum Pay RM 350 / Pay only minimum\nPay RM600/\namount",
        "confidence": 1.0,
        "normalized_value": ""
      },
      {
        "type": "table_item",
        "mention_text": "rieval Fee / Permintaan Draf Jualan",
        "confidence": 1.0,
        "normalized_value": ""
      },
      {
        "type": "table_item",
        "mention_text": "und of Credit Balance / Pemulangan Baki Kredit",
        "confidence": 1.0,
        "normalized_value": ""
      },
      {
        "type": "table_item",
        "mention_text": "Pelan Flexi Credit / Pelan Easi-Payment dan / atau Penukaran\nPembayaran bagi",
        "confidence": 1.0,
        "normalized_value": ""
      },
      {
        "type": "table_item",
        "mention_text": "Conversion for overseas transactions / Penukaran bagi transaksi luar",
        "confidence": 1.0,
        "normalized_value": ""
      },
      {
        "type": "table_item",
        "mention_text": "MasterCard International pada kadar pertukaran yang",
        "confidence": 1.0,
        "normalized_value": ""
      },
      {
        "type": "table_item",
        "mention_text": "Malaysia akan dikenakan",
        "confidence": 1.0,
        "normalized_value": ""
      },
      {
        "type": "table_item",
        "mention_text": "H) Dynamic Currency Conversion (DCC) Service",
        "confidence": 1.0,
        "normalized_value": ""
      },
      {
        "type": "table_item",
        "mention_text": "git Malaysia transaction",
        "confidence": 1.0,
        "normalized_value": ""
      },
      {
        "type": "table_item",
        "mention_text": "akan dikenakan fi DCC",
        "confidence": 1.0,
        "normalized_value": ""
      },
      {
        "type": "table_item",
        "mention_text": "yang dikenakan dengan Caj Kewangan",
        "confidence": 1.0,
        "normalized_value": ""
      },
      {
        "type": "table_item",
        "mention_text": "dikenakan dengan Caj Kewangan",
        "confidence": 1.0,
        "normalized_value": ""
      },
      {
        "type": "table_item",
        "mention_text": "tertunggak yang\ndikira berdasarkan baki harian",
        "confidence": 1.0,
        "normalized_value": ""
      },
      {
        "type": "table_item",
        "mention_text": ", 082-287 121 (Kuching), 088-477 121 (Kota Kinabalu)\natau e-mel kepada uobcustomerservice@uob.com.my tentang sebarang ketidaks amaan dalam masa 14 hari dari tarikh penyata. Jika aduan",
        "confidence": 1.0,
        "normalized_value": ""
      },
      {
        "type": "table_item",
        "mention_text": "diselesaikan dalam jangka masa yang dijanjikan, anda boleh mengemukakan aduan tersebut kepada Bank Negara Malaysia",
        "confidence": 1.0,
        "normalized_value": ""
      },
      {
        "type": "table_item",
        "mention_text": "dengan menghubungi BNMTELELINK di 1-300-88-5465 (9 pagi - 5 petang ) atau e-mel bnmtelelink@bnm.",
        "confidence": 1.0,
        "normalized_value": ""
      },
      {
        "type": "table_item",
        "mention_text": "CHEOK JUN YOON",
        "confidence": 1.0,
        "normalized_value": ""
      },
      {
        "type": "table_item",
        "mention_text": "190.87",
        "confidence": 1.0,
        "normalized_value": ""
      },
      {
        "type": "table_item",
        "mention_text": "09 AU 190.87",
        "confidence": 1.0,
        "normalized_value": ""
      },
      {
        "type": "table_item",
        "mention_text": "13 AUG CASH REBATE OTHERS 12.04",
        "confidence": 1.0,
        "normalized_value": ""
      },
      {
        "type": "table_item",
        "mention_text": "13 AUG CASH REBATE PETROL 15.00",
        "confidence": 1.0,
        "normalized_value": ""
      },
      {
        "type": "table_item",
        "mention_text": "13 JUL PETRON LABU SPUR ( 60.00",
        "confidence": 1.0,
        "normalized_value": ""
      },
      {
        "type": "table_item",
        "mention_text": "16 JUL PSS-AMPAR TENANG DENGKIL\nMY 30.00",
        "confidence": 1.0,
        "normalized_value": ""
      },
      {
        "type": "table_item",
        "mention_text": "AMWAY-SEREMBAN\nPETALING JAYA\nMY 19.00",
        "confidence": 1.0,
        "normalized_value": ""
      },
      {
        "type": "table_item",
        "mention_text": "PETRON MRR2 MELATI\nKUALA LUMPUR\nMY 60.00",
        "confidence": 1.0,
        "normalized_value": ""
      },
      {
        "type": "table_item",
        "mention_text": "PETRON LABU SPUR (FI) SEREMBAN\nMY 60.00",
        "confidence": 1.0,
        "normalized_value": ""
      },
      {
        "type": "table_item",
        "mention_text": "PSS-AMPAR TENANG\nDENGKIL\nMY 75.01",
        "confidence": 1.0,
        "normalized_value": ""
      },
      {
        "type": "table_item",
        "mention_text": "PETRON LABU SPUR (FI) SEREMBAN\nMY 60.00",
        "confidence": 1.0,
        "normalized_value": ""
      },
      {
        "type": "table_item",
        "mention_text": "PSS S2 CITY PARK (LOT C) N SEMBILAN\nMY 66.80",
        "confidence": 1.0,
        "normalized_value": ""
      },
      {
        "type": "table_item",
        "mention_text": "PETRONAS RAWAT & REHAT(S)\nSELANGOR\nMY 60.40",
        "confidence": 1.0,
        "normalized_value": ""
      },
      {
        "type": "table_item",
        "mention_text": "AI SMART TECH\nSHAH ALAM\nMY 6,001.00",
        "confidence": 1.0,
        "normalized_value": ""
      },
      {
        "type": "table_item",
        "mention_text": "02 AUG PSS-KESAS AWAN BESAR\nSHAH ALAM\nMY 60.50",
        "confidence": 1.0,
        "normalized_value": ""
      },
      {
        "type": "table_item",
        "mention_text": "04 AUG PSS-KESAS AWAN BESAR\nSHAH ALAM\nMY 75.99",
        "confidence": 1.0,
        "normalized_value": ""
      },
      {
        "type": "table_item",
        "mention_text": "06 AUG LATE FEE CHARGE 10.00",
        "confidence": 1.0,
        "normalized_value": ""
      },
      {
        "type": "table_item",
        "mention_text": "06 AUG PSS-AMPAR TENANG DENGKIL\nMY 60.01",
        "confidence": 1.0,
        "normalized_value": ""
      },
      {
        "type": "table_item",
        "mention_text": "PETRON LABU SPUR (FI) SEREMBAN\nMY 60.00",
        "confidence": 1.0,
        "normalized_value": ""
      },
      {
        "type": "table_item",
        "mention_text": "13 AUG RETAIL INTEREST 50.10",
        "confidence": 1.0,
        "normalized_value": ""
      },
      {
        "type": "table_item",
        "mention_text": "02 AUG",
        "confidence": 1.0,
        "normalized_value": ""
      },
      {
        "type": "table_item",
        "mention_text": "31 JUL BC INTEREST\n07/123.990% 30.58",
        "confidence": 1.0,
        "normalized_value": ""
      },
      {
        "type": "table_item",
        "mention_text": "31 JUL BC INSTALMENT 07/12 - 3.990% 766.44",
        "confidence": 1.0,
        "normalized_value": ""
      },
      {
        "type": "table_item",
        "mention_text": "05 AUG FCP INTEREST\n06/364.990% 32.85",
        "confidence": 1.0,
        "normalized_value": ""
      },
      {
        "type": "table_item",
        "mention_text": "13 AU RETAIL INTEREST 46.21",
        "confidence": 1.0,
        "normalized_value": ""
      },
      {
        "type": "table_item",
        "mention_text": "Ringkasan Transaksi Pinjaman Ansuran UOB",
        "confidence": 1.0,
        "normalized_value": ""
      },
      {
        "type": "table_item",
        "mention_text": "Sila rujuk jadual Huraian Transaksi jika anda mempunyai lebih daripada 300 pinjaman ansuran aktif",
        "confidence": 1.0,
        "normalized_value": ""
      },
      {
        "type": "table_item",
        "mention_text": "inggit Lupus Pada",
        "confidence": 1.0,
        "normalized_value": ""
      }
    ],
    "tables": []
  }
}